<jsonview-configuration xmlns:xsi="http://www.w3.org/2001/XMLSchema-instance"
	xmlns="http://www.developframework.org/schema/jsonview3" 
	xsi:schemaLocation="
	http://www.developframework.org/schema/jsonview3 
	http://www.developframework.org/schema/jsonview3/jsonview-configuration-3.0.xsd">
	<jsonview-package namespace="jsonview-student">
		<jsonview id="student-detail-view" data="student">
			<import id="student-detail"/>
		</jsonview>
		
		<jsonview id="student-list-view">
			<array data="students">
				<import id="student-detail"/>
			</array>
		</jsonview>
		
		<jsonview id="student-detail" data="student">
			<property data="id"/>
			<property data="name"/>
			<property data="classId"/>
			<property-date data="birthday" pattern="yyyy-MM-dd"/>
		</jsonview>
	</jsonview-package>
</jsonview-configuration>
