<jsonview-configuration xmlns:xsi="http://www.w3.org/2001/XMLSchema-instance"
	xmlns="http://www.developframework.org/schema/jsonview3" 
	xsi:schemaLocation="
	http://www.developframework.org/schema/jsonview3 
	http://www.developframework.org/schema/jsonview3/jsonview-configuration-3.0.xsd">
	<jsonview-package namespace="jsonview-class">
		<!-- 班级详情 -->
		<jsonview id="class-detail">
			<property data="id"/>
			<property data="className"/>
			<mapping-object data="#students" source="id"  target="classId" alias="student" type="multiple">
				<!-- 引用学生详情视图 -->
				<import id="student-detail" namespace="jsonview-student"/>
			</mapping-object>
		</jsonview>
		<!-- 班级列表视图 -->
		<jsonview id="class-list-view">
			<array data="schoolClasses">
				<import id="class-detail"/>
			</array>
		</jsonview>
	</jsonview-package>
</jsonview-configuration>
