<jsonview-configuration
	xmlns="http://www.developframework.org/schema/jsonview3" xmlns:xsi="http://www.w3.org/2001/XMLSchema-instance"
	xsi:schemaLocation="
	http://www.developframework.org/schema/jsonview3 
	http://www.developframework.org/schema/jsonview3/jsonview-configuration-3.0.xsd">

	<jsonview-package namespace="jsonview-demo">

		<jsonview id="user-list">
			<array data="users">
				<property data="id" />
				<property data="name" />
				
				<link-object data="#favorites">
					<property data="item" />
				</link-object>
			</array>
		</jsonview>
		
		<jsonview id="user-detail" data="user" for-class="test.User">
			<property-date data="birthday" pattern="yyyy-MM-dd"/>
			<array data="likes" for-class="test.Like"/>
		</jsonview>
	</jsonview-package>
</jsonview-configuration>
